{
  "categories": [
    "contract",
    "unit"
  ],
  "commands": [
    "rtk proxy python3 scripts/validate_plugin.py",
    "rtk proxy python3 scripts/validate_progressive_docs.py docs/features/fast-complete-feature-artifacts",
    "Deferred: existing architecture guidance records project-subagent; current schema requires actual project-skill lookup before approval and final verification. Earlier local quick_validate runs are not used as current evidence."
  ],
  "evidence_source": "agent-observed",
  "implementation_fingerprints": {
    "dispatcher/architecture-guidance.schema.json": "0f51e44cf90cc1ee8d233d4a8d38b30670ad77c678355095604057fb8f202069",
    "references/architecture-guidance.md": "baecc10fbfa8502e89d173431a81a0db941cae73da2e437e933fbad5ed3aa2c3",
    "references/artifact-basics.md": "46766597cb59f03455b3593eacde3bd2e56626ec973d0f298397b18880c88be6",
    "references/progressive-artifacts.md": "b3fb31f109bf6c451f1acaef7e9714a0232b36ec53e4b0ad18e3e4bff202f1ed",
    "scripts/test_plugin_surface.py": "01c2319df062d26fd68b4f4d538bc0081e2ce4dd507733232bad4a1d1fa69b1d",
    "scripts/validate_plugin.py": "eb340f7b0d3e393df95ef833bf52fa0ab291e6c822e2bbdd4b69992d748e39d8",
    "scripts/validate_progressive_docs.py": "67ba64cac977c1511417dcf1ace6b5a9bf286fdb449298afe7ba467af770a345",
    "skills/amend/SKILL.md": "35e3ff8cd7fc20afa62bd0458aa8f251c1ba46b304a41a40b1f7ac946dfcc9e3",
    "skills/implement/SKILL.md": "cb9372383b33af7725815687ac453bab9610914ba711c884e1d5eb7ea9393cdd",
    "skills/start/SKILL.md": "ddf07cca6bcaa675a98cfbe057ed5b7a8208b373d72c508b5c7ce6821e8dc688",
    "skills/verify/SKILL.md": "63176018a431b9ac42304e98bb084c0b6555e9c0f14daef1e784d1e5928333f1"
  },
  "input_fingerprints": {
    "design.md": "f34527260553e615cc100ae2563af2ed9bad42ffbb8505d492fd09e800ce4a85",
    "spec.md": "fc826d7bdd159b91405a18086896e5c61facf0a0f728254d871b93ca31e4eed6",
    "specs": "8c2a0aeef0722431a8c6a154fecddfe551e99ec6dbaaa44cd42ca8dfff05f005",
    "tasks.md": "6f9af7d90b491a0c8a05b055729c31849652ac5d78a57a079c847c8340759359"
  },
  "status": "validation-deferred"
}
